{
  "$schema": "https://schemas.kulpa.io/statements/1.0/schema.json",
  "id": "complaint-statement",
  "name": "Complaint Statement",
  "title": "Customer Complaint Form",
  "fields": [
    {
      "id": "page_complaint",
      "type": "page",
      "title": "Complaint",
      "fields": [
        {
          "id": "customer_name",
          "type": "string",
          "label": "Customer Name",
          "properties": {
            "required": true
          }
        },
        {
          "id": "order_id",
          "type": "caseNumber",
          "label": "Order Number",
          "properties": {
            "required": true,
            "placeholder": "ORD-12345"
          }
        },
        {
          "id": "incident_date",
          "type": "date",
          "label": "Date of Incident",
          "properties": {
            "required": true
          }
        },
        {
          "id": "complaint_type",
          "type": "select",
          "label": "Complaint Category",
          "properties": {
            "options": [
              {
                "value": "delivery",
                "title": "Delivery Issue"
              },
              {
                "value": "product",
                "title": "Product Quality"
              },
              {
                "value": "service",
                "title": "Customer Service"
              },
              {
                "value": "other",
                "title": "Other"
              }
            ],
            "required": true
          }
        },
        {
          "id": "description",
          "type": "longform",
          "label": "Details of Complaint",
          "properties": {
            "required": true,
            "placeholder": "Please describe what happened in detail..."
          }
        },
        {
          "id": "contact_back",
          "type": "boolean",
          "label": "Do you wish to be contacted?"
        }
      ]
    }
  ],
  "textTemplate": "Complaint from {{customer_name}} regarding {{complaint_type}} for order {{order_id}}."
}
